{"v":1,"type":"result","node":"probe-a4c1f8","msg_id":"01J8X2KB0007","ts":1755302400,
 "data":{"event":"chunk","job_id":"job-7f3a97","seq":0,
 "devices":[{"mac":"4c:11:ae:1a:2b:3c","name":"Mi Band","rssi":-72,
 "connectable":true,"manufacturer":"0157"},
 {"mac":"c0:28:8d:44:55:66","name":null,"rssi":-88,"connectable":false}]}}
